id,conversation_id,created_at,date,time,timezone,user_id,username,name,place,tweet,mentions,urls,photos,replies_count,retweets_count,likes_count,hashtags,cashtags,link,retweet,quote_url,video,near,geo,source,user_rt_id,user_rt,retweet_id,reply_to,retweet_date,translate,trans_src,trans_dest
1245036586548359168,1245036586548359168,1585674828000,2020-03-31,22:43:48,India Standard Time,18839785,narendramodi,Narendra Modi,,Admirable commitment to service and national development shown by the Tata Group. I welcome their gesture of contributing to PM-CARES. Their contribution will touch the lives of many Indians. I thank @TataCompanies and Shri Ratan Tata Ji. #IndiaFightsCorona https://twitter.com/TataCompanies/status/1244996131731447808 …,['tatacompanies'],['https://twitter.com/TataCompanies/status/1244996131731447808'],[],1505,7491,44300,['#indiafightscorona'],[],https://twitter.com/narendramodi/status/1245036586548359168,False,https://twitter.com/TataCompanies/status/1244996131731447808,0,,,,,,,"[{'user_id': '18839785', 'username': 'narendramodi'}, {'user_id': '270771330', 'username': 'TataCompanies'}]",,Admirable commitment to service and national development shown by the Tata Group. I welcome their gesture of contributing to PM-CARES. Their contribution will touch the lives of many Indians. I thank @TataCompanies and Shri Ratan Tata Ji. #IndiaFightsCorona https://twitter.com/TataCompanies/status/1244996131731447808 …,en,en
1245036251087900672,1245036251087900672,1585674748000,2020-03-31,22:42:28,India Standard Time,18839785,narendramodi,Narendra Modi,,"Have been seeing thoughtful messages of young children contributing to PM-CARES. This is special because they are contributing from their piggy banks. We yet again see the large-heartedness of young India. #IndiaFightsCorona
 https://twitter.com/Kuldeepbpcl/status/1244214976694210560 …
 https://twitter.com/SriramOptimist/status/1244540096663015427 … https://twitter.com/alok_bhatt/status/1244608713689903105 …",[],"['https://twitter.com/Kuldeepbpcl/status/1244214976694210560', 'https://twitter.com/SriramOptimist/status/1244540096663015427', 'https://twitter.com/alok_bhatt/status/1244608713689903105']",[],646,3920,25266,['#indiafightscorona'],[],https://twitter.com/narendramodi/status/1245036251087900672,False,https://twitter.com/alok_bhatt/status/1244608713689903105,0,,,,,,,"[{'user_id': '18839785', 'username': 'narendramodi'}]",,"Have been seeing thoughtful messages of young children contributing to PM-CARES. This is special because they are contributing from their piggy banks. We yet again see the large-heartedness of young India. #IndiaFightsCorona
 https://twitter.com/Kuldeepbpcl/status/1244214976694210560 …
 https://twitter.com/SriramOptimist/status/1244540096663015427 … https://twitter.com/alok_bhatt/status/1244608713689903105 …",en,en
1245035807976505344,1245035807976505344,1585674642000,2020-03-31,22:40:42,India Standard Time,18839785,narendramodi,Narendra Modi,,"During #MannKiBaat too I had interacted with those who successfully battled COVID-19. It is important to hear their experiences and learn.

The right precautions matter.

Follow self-discipline.

Listen to what your doctor is saying. #IndiaFightsCorona https://twitter.com/ANI/status/1244893436655747073 …",[],['https://twitter.com/ANI/status/1244893436655747073'],[],473,2569,15742,"['#mannkibaat', '#indiafightscorona']",[],https://twitter.com/narendramodi/status/1245035807976505344,False,https://twitter.com/ANI/status/1244893436655747073,0,,,,,,,"[{'user_id': '18839785', 'username': 'narendramodi'}]",,"During #MannKiBaat too I had interacted with those who successfully battled COVID-19. It is important to hear their experiences and learn.

The right precautions matter.

Follow self-discipline.

Listen to what your doctor is saying. #IndiaFightsCorona https://twitter.com/ANI/status/1244893436655747073 …",en,en
1245035461761892352,1245035461761892352,1585674560000,2020-03-31,22:39:20,India Standard Time,18839785,narendramodi,Narendra Modi,,"Every effort counts, every contribution matters. I thank leading film personalities @MadhuriDixit, @bhumipednekar, @ayushmannk, @aliaa08, @karanjohar for supporting PM-CARES. 

By being proactive and taking right precautions we have to overcome COVID-19. #IndiaFightsCorona","['madhuridixit', 'bhumipednekar', 'ayushmannk', 'aliaa08', 'karanjohar']",[],[],1358,5051,43976,['#indiafightscorona'],[],https://twitter.com/narendramodi/status/1245035461761892352,False,,0,,,,,,,"[{'user_id': '18839785', 'username': 'narendramodi'}, {'user_id': '220228167', 'username': 'MadhuriDixit'}, {'user_id': '243332437', 'username': 'bhumipednekar'}, {'user_id': '38403110', 'username': 'ayushmannk'}, {'user_id': '183230911', 'username': 'aliaa08'}, {'user_id': '57928790', 'username': 'karanjohar'}]",,"Every effort counts, every contribution matters. I thank leading film personalities @MadhuriDixit, @bhumipednekar, @ayushmannk, @aliaa08, @karanjohar for supporting PM-CARES. 

By being proactive and taking right precautions we have to overcome COVID-19. #IndiaFightsCorona",en,en
1245035300323094528,1245035300323094528,1585674521000,2020-03-31,22:38:41,India Standard Time,18839785,narendramodi,Narendra Modi,,"Rising to the occasion for a healthier India, showing leadership and compassion. 

Thank you @IRSAssociation, @MEAIndia, @SteelMinIndia, @IndiaCoastGuard Wives Welfare Association, Coal India for the contribution to PM-CARES. #IndiaFightsCorona","['irsassociation', 'meaindia', 'steelminindia', 'indiacoastguard']",[],[],621,3444,23755,['#indiafightscorona'],[],https://twitter.com/narendramodi/status/1245035300323094528,False,,0,,,,,,,"[{'user_id': '18839785', 'username': 'narendramodi'}, {'user_id': '4076775134', 'username': 'IRSAssociation'}, {'user_id': '441636351', 'username': 'MEAIndia'}, {'user_id': '761163448059301888', 'username': 'SteelMinIndia'}, {'user_id': '897819527508926464', 'username': 'IndiaCoastGuard'}]",,"Rising to the occasion for a healthier India, showing leadership and compassion. 

Thank you @IRSAssociation, @MEAIndia, @SteelMinIndia, @IndiaCoastGuard Wives Welfare Association, Coal India for the contribution to PM-CARES. #IndiaFightsCorona",en,en
1244965127574532107,1244965127574532107,1585657791000,2020-03-31,17:59:51,India Standard Time,18839785,narendramodi,Narendra Modi,,"जब भी देश सेवा की बात सामने आती है, @yogrishiramdev जी हमेशा आगे रहते हैं। कोरोना के खिलाफ देश की लड़ाई में इस योगदान के लिए आपका बहुत-बहुत आभार। #IndiaFightsCorona https://twitter.com/yogrishiramdev/status/1244576129970663424 …",['yogrishiramdev'],['https://twitter.com/yogrishiramdev/status/1244576129970663424'],[],1830,8001,49786,['#indiafightscorona'],[],https://twitter.com/narendramodi/status/1244965127574532107,False,https://twitter.com/yogrishiramdev/status/1244576129970663424,0,,,,,,,"[{'user_id': '18839785', 'username': 'narendramodi'}, {'user_id': '559345507', 'username': 'yogrishiramdev'}]",,@Yogrishiramdev ji is always ahead whenever it comes to Desh Seva. Thank you very much for this contribution to the country's fight against Corona. #IndiaFightsCorona https://twitter.com/yogrishiramdev/status/1244576129970663424…,hi,en
1244965038290395136,1244965038290395136,1585657770000,2020-03-31,17:59:30,India Standard Time,18839785,narendramodi,Narendra Modi,,I salute Bharti Enterprises and Sunil Bharti Mittal Ji for the strong support in this battle against COVID-19. The humanitarian efforts of this group during this time will help many Indians. #IndiaFightsCorona https://twitter.com/airtelnews/status/1244865972114092032 …,[],['https://twitter.com/airtelnews/status/1244865972114092032'],[],1063,4872,28692,['#indiafightscorona'],[],https://twitter.com/narendramodi/status/1244965038290395136,False,https://twitter.com/airtelnews/status/1244865972114092032,0,,,,,,,"[{'user_id': '18839785', 'username': 'narendramodi'}]",,I salute Bharti Enterprises and Sunil Bharti Mittal Ji for the strong support in this battle against COVID-19. The humanitarian efforts of this group during this time will help many Indians. #IndiaFightsCorona https://twitter.com/airtelnews/status/1244865972114092032 …,en,en
1244964872816717825,1244964872816717825,1585657730000,2020-03-31,17:58:50,India Standard Time,18839785,narendramodi,Narendra Modi,,"The entire Reliance team has been making effective contributions in the fight against COVID-19. Be it in healthcare or assisting people, they have been active. 

I thank Mukesh & Nita Ambani Ji for contributing to PM-CARES and for their other work towards defeating Coronavirus. https://twitter.com/ril_foundation/status/1244630742967054336 …",[],['https://twitter.com/ril_foundation/status/1244630742967054336'],[],1544,7940,54951,[],[],https://twitter.com/narendramodi/status/1244964872816717825,False,https://twitter.com/ril_foundation/status/1244630742967054336,0,,,,,,,"[{'user_id': '18839785', 'username': 'narendramodi'}]",,"The entire Reliance team has been making effective contributions in the fight against COVID-19. Be it in healthcare or assisting people, they have been active. 

I thank Mukesh & Nita Ambani Ji for contributing to PM-CARES and for their other work towards defeating Coronavirus. https://twitter.com/ril_foundation/status/1244630742967054336 …",en,en
1244964673172033538,1244964673172033538,1585657683000,2020-03-31,17:58:03,India Standard Time,18839785,narendramodi,Narendra Modi,,Thank you @JSPLCorporate. This gesture is very helpful. #IndiaFightsCorona https://twitter.com/MPNaveenJindal/status/1244850724871106560 …,['jsplcorporate'],['https://twitter.com/MPNaveenJindal/status/1244850724871106560'],[],282,2980,17655,['#indiafightscorona'],[],https://twitter.com/narendramodi/status/1244964673172033538,False,https://twitter.com/MPNaveenJindal/status/1244850724871106560,0,,,,,,,"[{'user_id': '18839785', 'username': 'narendramodi'}, {'user_id': '1568069497', 'username': 'JSPLCorporate'}]",,Thank you @JSPLCorporate. This gesture is very helpful. #IndiaFightsCorona https://twitter.com/MPNaveenJindal/status/1244850724871106560 …,en,en
1244964413754368001,1244964413754368001,1585657621000,2020-03-31,17:57:01,India Standard Time,18839785,narendramodi,Narendra Modi,,"कोरोना से लड़ने के लिए हर क्षेत्र के लोग सहयोग के लिए आगे आ रहे हैं। देश की यही वो सामूहिक ताकत है, जो इस लड़ाई में जीत दिलाएगी। 

PM-CARES में योगदान के लिए मैं @RajatSharmaLive जी और @PrabhuChawla जी का अभिनंदन करता हूं। #IndiaFightsCorona","['rajatsharmalive', 'prabhuchawla']",[],[],5037,9574,81819,['#indiafightscorona'],[],https://twitter.com/narendramodi/status/1244964413754368001,False,,0,,,,,,,"[{'user_id': '18839785', 'username': 'narendramodi'}, {'user_id': '122658025', 'username': 'RajatSharmaLive'}, {'user_id': '40400019', 'username': 'PrabhuChawla'}]",,"People from all walks of life are coming forward to fight against Corona. This is the collective strength of the country that will win this battle.

I congratulate @RajatSharmaLive ji and @PrabhuChawla ji for contributing to PM-CARES. #IndiaFightsCorona",hi,en
1244964177342394370,1244964177342394370,1585657564000,2020-03-31,17:56:04,India Standard Time,18839785,narendramodi,Narendra Modi,,"India’s stars are playing a starring role even in ensuring the health of the nation. They’re playing a leading role in raising awareness as well as in contributing to PM-CARES. Thanks @nanagpatekar, @AjayDevgnFilms, @TheAaryanKartik and @TheShilpaShetty.","['nanagpatekar', 'ajaydevgnfilms', 'theaaryankartik', 'theshilpashetty']",[],[],752,4890,37410,[],[],https://twitter.com/narendramodi/status/1244964177342394370,False,,0,,,,,,,"[{'user_id': '18839785', 'username': 'narendramodi'}, {'user_id': '744546364315435008', 'username': 'nanagpatekar'}, {'user_id': '878221529972191232', 'username': 'AjayDevgnFilms'}, {'user_id': '531976957', 'username': 'TheAaryanKartik'}, {'user_id': '115341081', 'username': 'TheShilpaShetty'}]",,"India’s stars are playing a starring role even in ensuring the health of the nation. They’re playing a leading role in raising awareness as well as in contributing to PM-CARES. Thanks @nanagpatekar, @AjayDevgnFilms, @TheAaryanKartik and @TheShilpaShetty.",en,en
1244964086909034496,1244964086909034496,1585657543000,2020-03-31,17:55:43,India Standard Time,18839785,narendramodi,Narendra Modi,,"Not only are the oil & gas sector PSUs energising India’s growth trajectory, but they are also contributing to ensure the nation’s good health in the time of COVID-19 crisis. 
Special thanks to @ONGC_ employees who have contributed 2 days’ salary to PM-CARES. @dpradhanbjp","['ongc_', 'dpradhanbjp']",[],[],335,3123,21056,[],[],https://twitter.com/narendramodi/status/1244964086909034496,False,,0,,,,,,,"[{'user_id': '18839785', 'username': 'narendramodi'}, {'user_id': '2862755232', 'username': 'ONGC_'}, {'user_id': '1897514666', 'username': 'dpradhanbjp'}]",,"Not only are the oil & gas sector PSUs energising India’s growth trajectory, but they are also contributing to ensure the nation’s good health in the time of COVID-19 crisis. 
Special thanks to @ONGC_ employees who have contributed 2 days’ salary to PM-CARES. @dpradhanbjp",en,en
1244963986556063744,1244963986556063744,1585657519000,2020-03-31,17:55:19,India Standard Time,18839785,narendramodi,Narendra Modi,,"People from all walks of life have contributed to PM-CARES. They have given their hard-earned money to sharpen the fight against COVID-19.

I thank @Its_Badshah, @RanvirShorey and @GuruOfficial
for contributing to PM-CARES. This will encourage research on defeating Coronavirus.","['its_badshah', 'ranvirshorey', 'guruofficial']",[],[],313,2629,16976,[],[],https://twitter.com/narendramodi/status/1244963986556063744,False,,0,,,,,,,"[{'user_id': '18839785', 'username': 'narendramodi'}, {'user_id': '63662120', 'username': 'Its_Badshah'}, {'user_id': '79692602', 'username': 'RanvirShorey'}, {'user_id': '557264973', 'username': 'GuruOfficial'}]",,"People from all walks of life have contributed to PM-CARES. They have given their hard-earned money to sharpen the fight against COVID-19.

I thank @Its_Badshah, @RanvirShorey and @GuruOfficial
for contributing to PM-CARES. This will encourage research on defeating Coronavirus.",en,en
1244963869237235713,1244963869237235713,1585657491000,2020-03-31,17:54:51,India Standard Time,18839785,narendramodi,Narendra Modi,,"I am very happy that our hardworking sportspersons are at the forefront of the battle to defeat COVID-19.

I would like to thank @sharad_kumar01, @ImRo45, @singhesha10, @M_Raj03 for their contribution to PM-CARES. #IndiaFightsCorona","['sharad_kumar01', 'imro45', 'singhesha10', 'm_raj03']",[],[],794,4368,34736,['#indiafightscorona'],[],https://twitter.com/narendramodi/status/1244963869237235713,False,,0,,,,,,,"[{'user_id': '18839785', 'username': 'narendramodi'}, {'user_id': '626320647', 'username': 'sharad_kumar01'}, {'user_id': '121046433', 'username': 'ImRo45'}, {'user_id': '1037989446749106176', 'username': 'singhesha10'}, {'user_id': '2949561072', 'username': 'M_Raj03'}]",,"I am very happy that our hardworking sportspersons are at the forefront of the battle to defeat COVID-19.

I would like to thank @sharad_kumar01, @ImRo45, @singhesha10, @M_Raj03 for their contribution to PM-CARES. #IndiaFightsCorona",en,en
1244839357300629504,1244839357300629504,1585627805000,2020-03-31,09:40:05,India Standard Time,18839785,narendramodi,Narendra Modi,,"जब भी समय मिलता है, मैं हफ्ते में 1-2 बार योग निद्रा का अभ्यास करता हूं।

ये शरीर को स्वस्थ और मन को प्रसन्न रखता है, साथ ही तनाव और चिंता को कम करता है। इंटरनेट पर आपको योग निद्रा के कई वीडियो मिलेंगे। अंग्रेजी और हिन्दी में 1-1 वीडियो साझा कर रहा हूं। https://youtu.be/Yly6lxogjMc ",[],['https://youtu.be/Yly6lxogjMc'],[],3990,10376,63651,[],[],https://twitter.com/narendramodi/status/1244839357300629504,False,,0,,,,,,,"[{'user_id': '18839785', 'username': 'narendramodi'}]",,"Whenever I get time, I practice Yoga Nidra 1-2 times a week.

It keeps the body healthy and the mind happy, as well as reduces stress and anxiety. On the internet you will find many videos of Yoga Nidra. 1-1 video sharing in English and Hindi. https://youtu.be/Yly6lxogjMc",hi,en
1244838825018327042,1244838825018327042,1585627678000,2020-03-31,09:37:58,India Standard Time,18839785,narendramodi,Narendra Modi,,"Whenever I get time, I practice Yoga Nidra once or twice a week. 

It furthers overall well-being, relaxes the mind, reduces stress and anxiety. You will find many videos of Yoga Nidra on the net. I’m sharing a video each in English and Hindi. 

 https://youtu.be/E4fO1istXvo ",[],['https://youtu.be/E4fO1istXvo'],[],2359,10868,68789,[],[],https://twitter.com/narendramodi/status/1244838825018327042,False,,0,,,,,,,"[{'user_id': '18839785', 'username': 'narendramodi'}]",,"Whenever I get time, I practice Yoga Nidra once or twice a week. 

It furthers overall well-being, relaxes the mind, reduces stress and anxiety. You will find many videos of Yoga Nidra on the net. I’m sharing a video each in English and Hindi. 

 https://youtu.be/E4fO1istXvo ",en,en
1244656090404360192,1244656090404360192,1585584111000,2020-03-30,21:31:51,India Standard Time,18839785,narendramodi,Narendra Modi,,Interacted with heads of our Missions abroad on the COVID-19 situation. We discussed many issues including ways to combat Coronavirus and the role our Missions can play in assisting Indians abroad. http://nm-4.com/qwb9 ,[],['http://nm-4.com/qwb9'],[],3072,6918,51459,[],[],https://twitter.com/narendramodi/status/1244656090404360192,False,,0,,,,,,,"[{'user_id': '18839785', 'username': 'narendramodi'}]",,Interacted with heads of our Missions abroad on the COVID-19 situation. We discussed many issues including ways to combat Coronavirus and the role our Missions can play in assisting Indians abroad. http://nm-4.com/qwb9 ,en,en
1244616459382173702,1244616453896077312,1585574662000,2020-03-30,18:54:22,India Standard Time,18839785,narendramodi,Narendra Modi,,"Representatives from social organisations spoke at length about how they are working to fight Coronavirus. They are spreading awareness, emphasising on social distancing, feeding the poor and more. Their proactive efforts are laudable. #IndiaFightsCorona",[],[],[],566,2627,15973,['#indiafightscorona'],[],https://twitter.com/narendramodi/status/1244616459382173702,False,,0,,,,,,,"[{'user_id': '18839785', 'username': 'narendramodi'}]",,"Representatives from social organisations spoke at length about how they are working to fight Coronavirus. They are spreading awareness, emphasising on social distancing, feeding the poor and more. Their proactive efforts are laudable. #IndiaFightsCorona",en,en
1244616456504872960,1244616453896077312,1585574661000,2020-03-30,18:54:21,India Standard Time,18839785,narendramodi,Narendra Modi,,"Social organisations are embodiments of compassion. They have a deep-rooted connect with people and they are at the forefront of service. Their role is very important in times such as these, when we are battling the menace of COVID-19. #IndiaFightsCorona",[],[],[],437,2756,17766,['#indiafightscorona'],[],https://twitter.com/narendramodi/status/1244616456504872960,False,,0,,,,,,,"[{'user_id': '18839785', 'username': 'narendramodi'}]",,"Social organisations are embodiments of compassion. They have a deep-rooted connect with people and they are at the forefront of service. Their role is very important in times such as these, when we are battling the menace of COVID-19. #IndiaFightsCorona",en,en
1244616453896077312,1244616453896077312,1585574661000,2020-03-30,18:54:21,India Standard Time,18839785,narendramodi,Narendra Modi,,"In our country, social organisations have a very important role in ensuring positive changes in society. Today I interacted with leading social welfare organisations on ways to fight COVID-19. 

 https://www.pmindia.gov.in/en/news_updates/pm-interacts-with-social-welfare-organizations/?comment=disable …",[],['https://www.pmindia.gov.in/en/news_updates/pm-interacts-with-social-welfare-organizations/?comment=disable'],[],2521,6818,50786,[],[],https://twitter.com/narendramodi/status/1244616453896077312,False,,0,,,,,,,"[{'user_id': '18839785', 'username': 'narendramodi'}]",,"In our country, social organisations have a very important role in ensuring positive changes in society. Today I interacted with leading social welfare organisations on ways to fight COVID-19. 

 https://www.pmindia.gov.in/en/news_updates/pm-interacts-with-social-welfare-organizations/?comment=disable …",en,en
1244491530611470336,1244491530611470336,1585544877000,2020-03-30,10:37:57,India Standard Time,18839785,narendramodi,Narendra Modi,,"Condolences to you and the entire family, @OmarAbdullah. May his soul rest in peace. 

In this hour of grief, your call to avoid any large gathering is appreciable and will strengthen India’s fight against COVID-19. https://twitter.com/OmarAbdullah/status/1244319400854880256 …",['omarabdullah'],['https://twitter.com/OmarAbdullah/status/1244319400854880256'],[],1140,4075,40162,[],[],https://twitter.com/narendramodi/status/1244491530611470336,False,https://twitter.com/OmarAbdullah/status/1244319400854880256,0,,,,,,,"[{'user_id': '18839785', 'username': 'narendramodi'}, {'user_id': '138822469', 'username': 'OmarAbdullah'}]",,"Condolences to you and the entire family, @OmarAbdullah. May his soul rest in peace. 

In this hour of grief, your call to avoid any large gathering is appreciable and will strengthen India’s fight against COVID-19. https://twitter.com/OmarAbdullah/status/1244319400854880256 …",en,en
1244491316060229632,1244491316060229632,1585544825000,2020-03-30,10:37:05,India Standard Time,18839785,narendramodi,Narendra Modi,,"राजस्थान दिवस की वहां के सभी भाइयों और बहनों को ढेरों शुभकामनाएं। मेरी कामना है कि साहस, शौर्य और पराक्रम के लिए प्रसिद्ध यह प्रदेश प्रगति की राह पर निरंतर आगे बढ़े।",[],[],[],6402,14463,143015,[],[],https://twitter.com/narendramodi/status/1244491316060229632,False,,0,,,,,,,"[{'user_id': '18839785', 'username': 'narendramodi'}]",,"Best wishes to all the brothers and sisters of Rajasthan Day. I wish that this state, famous for its courage, valor and valor, continued on the path of progress.",hi,en
1244456357647933440,1244456351180316672,1585536491000,2020-03-30,08:18:11,India Standard Time,18839785,narendramodi,Narendra Modi,,The Yoga videos are available in different languages. Do have a look. Happy Yoga practicing.... https://www.youtube.com/channel/UCS_FdMUqwujoADaE-KiGsTw/playlists …,[],['https://www.youtube.com/channel/UCS_FdMUqwujoADaE-KiGsTw/playlists'],[],462,3151,16921,[],[],https://twitter.com/narendramodi/status/1244456357647933440,False,,0,,,,,,,"[{'user_id': '18839785', 'username': 'narendramodi'}]",,The Yoga videos are available in different languages. Do have a look. Happy Yoga practicing.... https://www.youtube.com/channel/UCS_FdMUqwujoADaE-KiGsTw/playlists …,en,en
1244456353956945921,1244456351180316672,1585536490000,2020-03-30,08:18:10,India Standard Time,18839785,narendramodi,Narendra Modi,,"I am neither a fitness expert nor a medical expert. Practising Yoga has been an integral part of my life for many years and I have found it beneficial. I am sure many of you also have other ways of remaining fit, which you also must share with others.",[],[],[],705,4101,28979,[],[],https://twitter.com/narendramodi/status/1244456353956945921,False,,0,,,,,,,"[{'user_id': '18839785', 'username': 'narendramodi'}]",,"I am neither a fitness expert nor a medical expert. Practising Yoga has been an integral part of my life for many years and I have found it beneficial. I am sure many of you also have other ways of remaining fit, which you also must share with others.",en,en
1244456351180316672,1244456351180316672,1585536489000,2020-03-30,08:18:09,India Standard Time,18839785,narendramodi,Narendra Modi,,"During yesterday’s #MannKiBaat, someone asked me about my fitness routine during this time. Hence, thought of sharing these Yoga videos.  I hope you also begin practising Yoga regularly. https://www.youtube.com/playlist?list=PLBG6UuYpOcTtJuejaJLPYjhEcjdslRWGY …",[],['https://www.youtube.com/playlist?list=PLBG6UuYpOcTtJuejaJLPYjhEcjdslRWGY'],[],2093,7490,45442,['#mannkibaat'],[],https://twitter.com/narendramodi/status/1244456351180316672,False,,0,,,,,,,"[{'user_id': '18839785', 'username': 'narendramodi'}]",,"During yesterday’s #MannKiBaat, someone asked me about my fitness routine during this time. Hence, thought of sharing these Yoga videos.  I hope you also begin practising Yoga regularly. https://www.youtube.com/playlist?list=PLBG6UuYpOcTtJuejaJLPYjhEcjdslRWGY …",en,en
