id,conversation_id,created_at,date,time,timezone,user_id,username,name,place,tweet,mentions,urls,photos,replies_count,retweets_count,likes_count,hashtags,cashtags,link,retweet,quote_url,video,near,geo,source,user_rt_id,user_rt,retweet_id,reply_to,retweet_date,translate,trans_src,trans_dest
1242095835774480387,1242095723568455682,1584973698000,2020-03-23,19:58:18,India Standard Time,18839785,narendramodi,Narendra Modi,,"We had extensive interactions on sectors like banking, finance, hospitality, tourism and infra. 
Government and industry are conscious about informal sector’s well-being.
Industry leaders highlighted steps towards maintaining supply lines of essential items and medical equipment.",[],[],[],324,2242,11108,[],[],https://twitter.com/narendramodi/status/1242095835774480387,False,,0,,,,,,,"[{'user_id': '18839785', 'username': 'narendramodi'}]",,"We had extensive interactions on sectors like banking, finance, hospitality, tourism and infra. 
Government and industry are conscious about informal sector’s well-being.
Industry leaders highlighted steps towards maintaining supply lines of essential items and medical equipment.",en,en
1242095723568455682,1242095723568455682,1584973672000,2020-03-23,19:57:52,India Standard Time,18839785,narendramodi,Narendra Modi,,"Spoke to those associated with the world of industry earlier this evening. In consultation with all the concerned stakeholders, the Government is working to ensure economic stability. #IndiaFightsCorona http://nm-4.com/1bb9 ",[],['http://nm-4.com/1bb9'],[],661,3784,22771,['#indiafightscorona'],[],https://twitter.com/narendramodi/status/1242095723568455682,False,,0,,,,,,,"[{'user_id': '18839785', 'username': 'narendramodi'}]",,"Spoke to those associated with the world of industry earlier this evening. In consultation with all the concerned stakeholders, the Government is working to ensure economic stability. #IndiaFightsCorona http://nm-4.com/1bb9 ",en,en
1242087698724077568,1242087698724077568,1584971758000,2020-03-23,19:25:58,India Standard Time,18839785,narendramodi,Narendra Modi,,Will be interacting with the citizens of Varanasi via video conferencing on the 25th at 5 PM. Join the interaction directly via the NaMo App. Do also share your ideas and suggestions for it. #IndiaFightsCorona http://nm-4.com/rbb9 ,[],['http://nm-4.com/rbb9'],[],955,4416,26217,['#indiafightscorona'],[],https://twitter.com/narendramodi/status/1242087698724077568,False,,0,,,,,,,"[{'user_id': '18839785', 'username': 'narendramodi'}]",,Will be interacting with the citizens of Varanasi via video conferencing on the 25th at 5 PM. Join the interaction directly via the NaMo App. Do also share your ideas and suggestions for it. #IndiaFightsCorona http://nm-4.com/rbb9 ,en,en
1242085949003030528,1242085949003030528,1584971341000,2020-03-23,19:19:01,India Standard Time,18839785,narendramodi,Narendra Modi,,कोरोना वायरस को लेकर उपजे हालात पर मैं अपने संसदीय क्षेत्र वाराणसी के लोगों से संवाद करूंगा। 25 मार्च को शाम 5 बजे वीडियो कॉन्फ्रेंसिंग से होने वाली इस बातचीत से आप जुड़ सकते हैं। अगर आपके पास कोई सुझाव या सवाल हो तो नरेन्द्र मोदी एप के कमेंट सेक्शन में जाकर साझा कर सकते हैं।,[],[],[],7804,14072,103150,[],[],https://twitter.com/narendramodi/status/1242085949003030528,False,,0,,,,,,,"[{'user_id': '18839785', 'username': 'narendramodi'}]",,"I will communicate with the people of my constituency Varanasi on the situation arising out of Corona virus. You can join this conversation through video conferencing at 5 pm on March 25. If you have any suggestion or question, Narendra Modi can share it by going to the comment section of the app.",hi,en
1242083672611676161,1242083672611676161,1584970799000,2020-03-23,19:09:59,India Standard Time,18839785,narendramodi,Narendra Modi,,"India is taking a wide-range of steps to defeat COVID-19. 

Do watch today's press briefing on the efforts being undertaken. #IndiaFightsCorona https://www.youtube.com/watch?v=AlrAbXwSa_A …",[],['https://www.youtube.com/watch?v=AlrAbXwSa_A'],[],1058,5436,29242,['#indiafightscorona'],[],https://twitter.com/narendramodi/status/1242083672611676161,False,,0,,,,,,,"[{'user_id': '18839785', 'username': 'narendramodi'}]",,"India is taking a wide-range of steps to defeat COVID-19. 

Do watch today's press briefing on the efforts being undertaken. #IndiaFightsCorona https://www.youtube.com/watch?v=AlrAbXwSa_A …",en,en
1242080827183214592,1242080827183214592,1584970120000,2020-03-23,18:58:40,India Standard Time,18839785,narendramodi,Narendra Modi,,"One thing I specially requested all media houses to do is to keep reiterating the importance of social distancing and being indoors. 

I urge them to keep stating- #StayHome.",[],[],[],2907,17354,92560,['#stayhome'],[],https://twitter.com/narendramodi/status/1242080827183214592,False,,0,,,,,,,"[{'user_id': '18839785', 'username': 'narendramodi'}]",,"One thing I specially requested all media houses to do is to keep reiterating the importance of social distancing and being indoors. 

I urge them to keep stating- #StayHome.",en,en
1242079271083864065,1242079264905691136,1584969749000,2020-03-23,18:52:29,India Standard Time,18839785,narendramodi,Narendra Modi,,"Even greater caution, zero carelessness. 

Urged electronic media to counter misinformation related to COVID-19, which is creating panic. Also urged them to take relevant precautions in their own organisations especially when their team members do on ground reporting.",[],[],[],262,2491,11548,[],[],https://twitter.com/narendramodi/status/1242079271083864065,False,,0,,,,,,,"[{'user_id': '18839785', 'username': 'narendramodi'}]",,"Even greater caution, zero carelessness. 

Urged electronic media to counter misinformation related to COVID-19, which is creating panic. Also urged them to take relevant precautions in their own organisations especially when their team members do on ground reporting.",en,en
1242079267908759553,1242079264905691136,1584969748000,2020-03-23,18:52:28,India Standard Time,18839785,narendramodi,Narendra Modi,,The media world has played a great role in spreading awareness on subjects related to COVID-19. I salute all those media persons who have been reporting from the ground as well as in the newsroom. Happy to see channels facilitating 'work from home arrangements' for their teams.,[],[],[],227,2541,13055,[],[],https://twitter.com/narendramodi/status/1242079267908759553,False,,0,,,,,,,"[{'user_id': '18839785', 'username': 'narendramodi'}]",,The media world has played a great role in spreading awareness on subjects related to COVID-19. I salute all those media persons who have been reporting from the ground as well as in the newsroom. Happy to see channels facilitating 'work from home arrangements' for their teams.,en,en
1242079264905691136,1242079264905691136,1584969748000,2020-03-23,18:52:28,India Standard Time,18839785,narendramodi,Narendra Modi,,"I have been having a series of video conference interactions with various stakeholders on tackling the COVID-19 menace. Today, I interacted with those associated with the electronic media and heard their insightful views. #IndiaFightsCorona http://nm-4.com/abb9 ",[],['http://nm-4.com/abb9'],[],717,4329,24599,['#indiafightscorona'],[],https://twitter.com/narendramodi/status/1242079264905691136,False,,0,,,,,,,"[{'user_id': '18839785', 'username': 'narendramodi'}]",,"I have been having a series of video conference interactions with various stakeholders on tackling the COVID-19 menace. Today, I interacted with those associated with the electronic media and heard their insightful views. #IndiaFightsCorona http://nm-4.com/abb9 ",en,en
1242009674226044936,1242009674226044936,1584953156000,2020-03-23,14:15:56,India Standard Time,18839785,narendramodi,Narendra Modi,,"Grateful to Prime Minister Sheikh Hasina of Bangladesh for announcing  $ 1.5 million as contribution to the COVID-19 Emergency Fund.  Through our solidarity and working together, we will overcome challenges posed by COVID-19.",[],[],[],1328,7150,55128,[],[],https://twitter.com/narendramodi/status/1242009674226044936,False,,0,,,,,,,"[{'user_id': '18839785', 'username': 'narendramodi'}]",,"Grateful to Prime Minister Sheikh Hasina of Bangladesh for announcing  $ 1.5 million as contribution to the COVID-19 Emergency Fund.  Through our solidarity and working together, we will overcome challenges posed by COVID-19.",en,en
1242009468197654528,1242009468197654528,1584953107000,2020-03-23,14:15:07,India Standard Time,18839785,narendramodi,Narendra Modi,,Sincerely thank President of Sri Lanka @GotabayaR for contributing $ 5 million to the SAARC COVID-19 Emergency Fund.  Our cooperation will go a long way in fighting this disease effectively.,['gotabayar'],[],[],513,5119,38004,[],[],https://twitter.com/narendramodi/status/1242009468197654528,False,,0,,,,,,,"[{'user_id': '18839785', 'username': 'narendramodi'}, {'user_id': '3191855185', 'username': 'GotabayaR'}]",,Sincerely thank President of Sri Lanka @GotabayaR for contributing $ 5 million to the SAARC COVID-19 Emergency Fund.  Our cooperation will go a long way in fighting this disease effectively.,en,en
1242007380784746497,1242007380784746497,1584952609000,2020-03-23,14:06:49,India Standard Time,18839785,narendramodi,Narendra Modi,,"Thank you Afghanistan, for contributing $ 1 Million to the COVID-19 Emergency Fund in solidarity with our South Asian neighborhood. Tashakkur President @ashrafghani.",['ashrafghani'],[],[],999,8121,69136,[],[],https://twitter.com/narendramodi/status/1242007380784746497,False,,0,,,,,,,"[{'user_id': '18839785', 'username': 'narendramodi'}, {'user_id': '46376581', 'username': 'ashrafghani'}]",,"Thank you Afghanistan, for contributing $ 1 Million to the COVID-19 Emergency Fund in solidarity with our South Asian neighborhood. Tashakkur President @ashrafghani.",en,en
1241957369862451202,1241957369862451202,1584940686000,2020-03-23,10:48:06,India Standard Time,18839785,narendramodi,Narendra Modi,,"Incase you missed it, here is the video link of the press conference by officials yesterday in which important decisions were announced regarding India’s battle against COVID-19. #IndiaFightsCorona https://youtu.be/0pClHlJVMO8 ",[],['https://youtu.be/0pClHlJVMO8'],[],1675,7689,39724,['#indiafightscorona'],[],https://twitter.com/narendramodi/status/1241957369862451202,False,,0,,,,,,,"[{'user_id': '18839785', 'username': 'narendramodi'}]",,"Incase you missed it, here is the video link of the press conference by officials yesterday in which important decisions were announced regarding India’s battle against COVID-19. #IndiaFightsCorona https://youtu.be/0pClHlJVMO8 ",en,en
1241954700284424192,1241954700284424192,1584940049000,2020-03-23,10:37:29,India Standard Time,18839785,narendramodi,Narendra Modi,,"Extremely proud of this team of @airindiain, which has shown utmost courage and risen to the call of humanity. Their outstanding efforts are admired by several people across India. #IndiaFightsCorona https://twitter.com/HardeepSPuri/status/1241777365631381507 …",['airindiain'],['https://twitter.com/HardeepSPuri/status/1241777365631381507'],[],1049,7311,44177,['#indiafightscorona'],[],https://twitter.com/narendramodi/status/1241954700284424192,False,https://twitter.com/HardeepSPuri/status/1241777365631381507,0,,,,,,,"[{'user_id': '18839785', 'username': 'narendramodi'}, {'user_id': '387573617', 'username': 'airindiain'}]",,"Extremely proud of this team of @airindiain, which has shown utmost courage and risen to the call of humanity. Their outstanding efforts are admired by several people across India. #IndiaFightsCorona https://twitter.com/HardeepSPuri/status/1241777365631381507 …",en,en
1241946877139927040,1241946877139927040,1584938184000,2020-03-23,10:06:24,India Standard Time,18839785,narendramodi,Narendra Modi,,"लॉकडाउन को अभी भी कई लोग गंभीरता से नहीं ले रहे हैं। कृपया करके अपने आप को बचाएं, अपने परिवार को बचाएं, निर्देशों का गंभीरता से पालन करें। राज्य सरकारों से मेरा अनुरोध है कि वो नियमों और कानूनों का पालन करवाएं।",[],[],[],27063,65300,256438,[],[],https://twitter.com/narendramodi/status/1241946877139927040,False,,0,,,,,,,"[{'user_id': '18839785', 'username': 'narendramodi'}]",,"Many people are still not taking the lockdown seriously. Please save yourself by doing this, save your family, follow the instructions seriously. I request the state governments to get the rules and laws followed.",hi,en
1241929335059054592,1241929335059054592,1584934002000,2020-03-23,08:56:42,India Standard Time,18839785,narendramodi,Narendra Modi,,Greetings to Smt. @smritiirani Ji on her birthday. She is proactively working towards furthering women empowerment and transforming the crucial textiles sector. Praying for her long and healthy life.,['smritiirani'],[],[],1218,5283,50916,[],[],https://twitter.com/narendramodi/status/1241929335059054592,False,,0,,,,,,,"[{'user_id': '18839785', 'username': 'narendramodi'}, {'user_id': '130104041', 'username': 'smritiirani'}]",,Greetings to Smt. @smritiirani Ji on her birthday. She is proactively working towards furthering women empowerment and transforming the crucial textiles sector. Praying for her long and healthy life.,en,en
1241915862744891392,1241915862744891392,1584930790000,2020-03-23,08:03:10,India Standard Time,18839785,narendramodi,Narendra Modi,,प्रखर समाजवादी चिंतक और लोकप्रिय राजनेता डॉ. राम मनोहर लोहिया जी को उनकी जयंती पर शत-शत नमन। सामाजिक सशक्तिकरण और सेवा भाव से जुड़े उनके विचार देशवासियों को सदैव प्रेरित करते रहेंगे।,[],[],[],783,5651,44267,[],[],https://twitter.com/narendramodi/status/1241915862744891392,False,,0,,,,,,,"[{'user_id': '18839785', 'username': 'narendramodi'}]",,"A big tribute to Dr. Ram Manohar Lohia ji, a prominent socialist thinker and popular politician, on his birth anniversary. His thoughts related to social empowerment and service will always inspire the countrymen.",hi,en
1241915487698563072,1241915487698563072,1584930700000,2020-03-23,08:01:40,India Standard Time,18839785,narendramodi,Narendra Modi,,"शहीद दिवस पर मां भारती के महान सपूत वीर भगत सिंह, सुखदेव और राजगुरु को कोटि-कोटि नमन। देश के लिए उनका बलिदान कृतज्ञ राष्ट्र सदा याद रखेगा। जय हिंद!",[],[],[],4768,21063,139656,[],[],https://twitter.com/narendramodi/status/1241915487698563072,False,,0,,,,,,,"[{'user_id': '18839785', 'username': 'narendramodi'}]",,"On Martyr's Day, the great sons of Mother Bharati, Veer Bhagat Singh, Sukhdev and Rajguru bowed down. A grateful nation will always remember his sacrifice for the country. Jai Hind!",hi,en
1241753102862221316,1241753102862221316,1584891985000,2020-03-22,21:16:25,India Standard Time,18839785,narendramodi,Narendra Modi,,"Strongly condemn the Maoist attack in Sukma, Chhattisgarh. My tributes to the security personnel martyred in the attack. Their valour will never be forgotten. Condolences to the bereaved families. I pray for a quick recovery of those injured.",[],[],[],3506,16683,99685,[],[],https://twitter.com/narendramodi/status/1241753102862221316,False,,0,,,,,,,"[{'user_id': '18839785', 'username': 'narendramodi'}]",,"Strongly condemn the Maoist attack in Sukma, Chhattisgarh. My tributes to the security personnel martyred in the attack. Their valour will never be forgotten. Condolences to the bereaved families. I pray for a quick recovery of those injured.",en,en
1241741576168075266,1241741576168075266,1584889236000,2020-03-22,20:30:36,India Standard Time,18839785,narendramodi,Narendra Modi,,"मां... 

मां आप जैसी करोड़ों माताओं के आशीर्वाद से कोरोना वायरस से लड़ रहे डॉक्टर, नर्स, मेडिकल स्टाफ, पुलिसकर्मी, सुरक्षाकर्मी, सफाईकर्मी और मीडियाकर्मी जैसे अनगिनत लोगों को बहुत प्रेरणा मिली। आगे काम करने का संबल मिला ।

 https://twitter.com/advaitakala/status/1241735798157762560?s=12 …
 https://twitter.com/indiiyogi/status/1241731724347731969?s=12 … https://twitter.com/ANI/status/1241717871396425729 …",[],"['https://twitter.com/advaitakala/status/1241735798157762560?s=12', 'https://twitter.com/indiiyogi/status/1241731724347731969?s=12', 'https://twitter.com/ANI/status/1241717871396425729']",[],4837,27748,129081,[],[],https://twitter.com/narendramodi/status/1241741576168075266,False,https://twitter.com/ANI/status/1241717871396425729,0,,,,,,,"[{'user_id': '18839785', 'username': 'narendramodi'}]",,"Mother ...

With the blessings of millions of mothers like you, countless people like doctors, nurses, medical staff, policemen, security personnel, scavengers and media workers fighting the corona virus were greatly inspired. Got the support to work further.

 https://twitter.com/advaitakala/status/1241735798157762560?s=12…
 https://twitter.com/indiiyogi/status/1241731724347731969?s=12… https://twitter.com/ANI/status/1241717871396425729…",hi,en
1241711724283088896,1241711720998899718,1584882119000,2020-03-22,18:31:59,India Standard Time,18839785,narendramodi,Narendra Modi,,"केंद्र सरकार और राज्य सरकारों द्वारा जारी किए जा रहे निर्देशों का जरूर पालन करें। जिन जिलों और राज्यों में Lockdown की घोषणा हुई है, वहां घरों से बिल्कुल बाहर न निकलें। इसके अलावा बाकी हिस्सों में भी जब तक बहुत जरूरी न हो, तब तक घरों से बाहर न निकलें। #JantaCurfew",[],[],[],2118,15085,66344,['#jantacurfew'],[],https://twitter.com/narendramodi/status/1241711724283088896,False,,0,,,,,,,"[{'user_id': '18839785', 'username': 'narendramodi'}]",,"Follow the instructions being issued by the central government and the state governments. In districts and states where the lockdown is announced, do not leave the houses at all. Apart from this, do not get out of the houses unless it is very necessary in the rest. #JantaCurfew",hi,en
1241711720998899718,1241711720998899718,1584882118000,2020-03-22,18:31:58,India Standard Time,18839785,narendramodi,Narendra Modi,,"आज का #JantaCurfew भले ही रात 9 बजे खत्म हो जाएगा, लेकिन इसका मतलब यह नहीं है कि हम सेलिब्रेशन शुरू कर दें। इसको सफलता न मानें। यह एक लम्बी लड़ाई की शुरुआत है। आज देशवासियों ने बता दिया कि हम सक्षम हैं, निर्णय कर लें तो बड़ी से बड़ी चुनौती को एक होकर हरा सकते हैं।",[],[],[],9782,37576,174980,['#jantacurfew'],[],https://twitter.com/narendramodi/status/1241711720998899718,False,,0,,,,,,,"[{'user_id': '18839785', 'username': 'narendramodi'}]",,"Today's #JantaCurfew may even end at 9 pm, but that doesn't mean we start celebrations. Do not consider it a success. This is the beginning of a long fight. Today the countrymen have told that we are capable, if we decide, we can beat the biggest challenge together.",hi,en
1241697758626508801,1241697755489112064,1584878789000,2020-03-22,17:36:29,India Standard Time,18839785,narendramodi,Narendra Modi,,"ये धन्यवाद का नाद है, लेकिन साथ ही एक लंबी लड़ाई में विजय की शुरुआत का भी नाद है। आइए, इसी संकल्प के साथ, इसी संयम के साथ एक लंबी लड़ाई के लिए अपने आप को बंधनों (Social Distancing) में बांध लें। #JantaCurfew",[],[],[],4413,21451,96662,['#jantacurfew'],[],https://twitter.com/narendramodi/status/1241697758626508801,False,,0,,,,,,,"[{'user_id': '18839785', 'username': 'narendramodi'}]",,"It is the sound of thanks, but also the beginning of victory in a long battle. Let us, with this resolve, tie ourselves in social distancing for a long battle with this restraint. #JantaCurfew",hi,en
1241697755489112064,1241697755489112064,1584878789000,2020-03-22,17:36:29,India Standard Time,18839785,narendramodi,Narendra Modi,,कोरोना वायरस की लड़ाई का नेतृत्व करने वाले प्रत्येक व्यक्ति को देश ने एक मन होकर धन्यवाद अर्पित किया। देशवासियों का बहुत-बहुत आभार... #JantaCurfew,[],[],[],14140,37005,195432,['#jantacurfew'],[],https://twitter.com/narendramodi/status/1241697755489112064,False,,0,,,,,,,"[{'user_id': '18839785', 'username': 'narendramodi'}]",,The country thanked each person who led the fight against the corona virus. Many thanks to the countrymen ... #JantaCurfew,hi,en
1241673542506180610,1241673542506180610,1584873016000,2020-03-22,16:00:16,India Standard Time,18839785,narendramodi,Narendra Modi,,"Do remember,

5 PM this evening for 5 minutes...

Be on your terraces, balconies or windows to express gratitude to all those who are working 24/7 so that our nation becomes free from COVID-19. #JantaCurfew pic.twitter.com/Cwds0v4cJ8",[],[],[],9463,18997,113377,['#jantacurfew'],[],https://twitter.com/narendramodi/status/1241673542506180610,False,,1,,,,,,,"[{'user_id': '18839785', 'username': 'narendramodi'}]",,"Do remember,

5 PM this evening for 5 minutes...

Be on your terraces, balconies or windows to express gratitude to all those who are working 24/7 so that our nation becomes free from COVID-19. #JantaCurfew pic.twitter.com/Cwds0v4cJ8",en,en
1241673267816968192,1241673267816968192,1584872950000,2020-03-22,15:59:10,India Standard Time,18839785,narendramodi,Narendra Modi,,"जनता कर्फ्यू की सफलता में मीडिया का बहुत बड़ा योगदान है। टीवी न्यूज की आपाधापी के बीच @TV9Bharatvarsh ने अपने एंकर से घर से ही बुलेटिन करवाने का जो प्रयोग किया है, वो सराहनीय है। कोरोना के खिलाफ लड़ाई में इसका बहुत लाभ होगा। #JantaCurfew https://twitter.com/TV9Bharatvarsh/status/1241590790876303361 …",['tv9bharatvarsh'],['https://twitter.com/TV9Bharatvarsh/status/1241590790876303361'],[],892,5613,35438,['#jantacurfew'],[],https://twitter.com/narendramodi/status/1241673267816968192,False,https://twitter.com/TV9Bharatvarsh/status/1241590790876303361,0,,,,,,,"[{'user_id': '18839785', 'username': 'narendramodi'}, {'user_id': '1039759933728645120', 'username': 'TV9Bharatvarsh'}]",,"Media has contributed a lot in the success of Janata curfew. Amidst the chaos of TV News, @ TV9Bharatvarsh's use of getting his anchor to bulletin from home is commendable. It will have great benefits in the fight against Corona. #JantaCurfew https://twitter.com/TV9Bharatvarsh/status/1241590790876303361…",hi,en
1241637711951216647,1241637711951216647,1584864473000,2020-03-22,13:37:53,India Standard Time,18839785,narendramodi,Narendra Modi,,"Excellent way to use the power of the media to spread a message of hope and positivity...that India will defeat COVID-19. 

Well done team @CNNnews18! #JantaCurfew https://twitter.com/CNNnews18/status/1241628176360468480 …",['cnnnews18'],['https://twitter.com/CNNnews18/status/1241628176360468480'],[],1086,4116,24641,['#jantacurfew'],[],https://twitter.com/narendramodi/status/1241637711951216647,False,https://twitter.com/CNNnews18/status/1241628176360468480,0,,,,,,,"[{'user_id': '18839785', 'username': 'narendramodi'}, {'user_id': '6509832', 'username': 'CNNnews18'}]",,"Excellent way to use the power of the media to spread a message of hope and positivity...that India will defeat COVID-19. 

Well done team @CNNnews18! #JantaCurfew https://twitter.com/CNNnews18/status/1241628176360468480 …",en,en
