id,conversation_id,created_at,date,time,timezone,user_id,username,name,place,tweet,mentions,urls,photos,replies_count,retweets_count,likes_count,hashtags,cashtags,link,retweet,quote_url,video,near,geo,source,user_rt_id,user_rt,retweet_id,reply_to,retweet_date,translate,trans_src,trans_dest
1241257296996364288,1241257296996364288,1584773775000,2020-03-21,12:26:15,India Standard Time,18839785,narendramodi,Narendra Modi,,"Minute precautions can make monumental impacts and save many lives. 

Saw this interesting video on social media. If you have such videos that can educate people and spread awareness on battling COVID-19, please do so using #IndiaFightsCorona. pic.twitter.com/OfguKRMs1g",[],[],[],3537,30401,87130,['#indiafightscorona'],[],https://twitter.com/narendramodi/status/1241257296996364288,False,,1,,,,,,,"[{'user_id': '18839785', 'username': 'narendramodi'}]",,"Minute precautions can make monumental impacts and save many lives. 

Saw this interesting video on social media. If you have such videos that can educate people and spread awareness on battling COVID-19, please do so using #IndiaFightsCorona. pic.twitter.com/OfguKRMs1g",en,en
1241256665292263429,1241256665292263429,1584773625000,2020-03-21,12:23:45,India Standard Time,18839785,narendramodi,Narendra Modi,,दिल्ली के ऑटो-टैक्सी यूनियन की इस पहल से कोरोना महामारी के खिलाफ देशवासियों की लड़ाई को एक नया बल मिलेगा। #IndiaFightsCorona https://navbharattimes.indiatimes.com/metro/delhi/other-news/auto-taxi-union-in-delhi-also-supports-public-curfew/articleshow/74735735.cms …,[],['https://navbharattimes.indiatimes.com/metro/delhi/other-news/auto-taxi-union-in-delhi-also-supports-public-curfew/articleshow/74735735.cms'],[],554,4253,21941,['#indiafightscorona'],[],https://twitter.com/narendramodi/status/1241256665292263429,False,,0,,,,,,,"[{'user_id': '18839785', 'username': 'narendramodi'}]",,This initiative of the Auto-Taxi Union of Delhi will give a new thrust to the fight of the countrymen against the corona epidemic. #IndiaFightsCorona https://navbharattimes.indiatimes.com/metro/delhi/other-news/auto-taxi-union-in-delhi-also-supports-public-curfew/articleshow/74735735.cms…,hi,en
1241256468801716227,1241256468801716227,1584773578000,2020-03-21,12:22:58,India Standard Time,18839785,narendramodi,Narendra Modi,,"Commendable effort by @TwitterIndia, which has launched a dedicated COVID-19 page that provides essential real-time updates to people from various authorities across India. #IndiaFightsCorona https://twitter.com/i/events/1240662046280048646 …",['twitterindia'],['https://twitter.com/i/events/1240662046280048646'],[],495,4067,17189,['#indiafightscorona'],[],https://twitter.com/narendramodi/status/1241256468801716227,False,,0,,,,,,,"[{'user_id': '18839785', 'username': 'narendramodi'}, {'user_id': '103770785', 'username': 'TwitterIndia'}]",,"Commendable effort by @TwitterIndia, which has launched a dedicated COVID-19 page that provides essential real-time updates to people from various authorities across India. #IndiaFightsCorona https://twitter.com/i/events/1240662046280048646 …",en,en
1241256145995485185,1241256145995485185,1584773501000,2020-03-21,12:21:41,India Standard Time,18839785,narendramodi,Narendra Modi,,"Sharing correct information, avoiding incorrect panic. 

Here is an effort by WhatsApp and @mygovindia to ensure you receive accurate and verified information on Coronavirus. 

Please click on this link  https://wa.me/919013151515?text=Hi … or send Hi on +919013151515. #IndiaFightsCorona pic.twitter.com/0maqUE3PvG",['mygovindia'],['https://wa.me/919013151515?text=Hi'],['https://pbs.twimg.com/media/ETnT2hOUEAAuoEe.jpg'],1004,9473,24146,['#indiafightscorona'],[],https://twitter.com/narendramodi/status/1241256145995485185,False,,0,,,,,,,"[{'user_id': '18839785', 'username': 'narendramodi'}, {'user_id': '2686834802', 'username': 'mygovindia'}]",,"Sharing correct information, avoiding incorrect panic. 

Here is an effort by WhatsApp and @mygovindia to ensure you receive accurate and verified information on Coronavirus. 

Please click on this link  https://wa.me/919013151515?text=Hi … or send Hi on +919013151515. #IndiaFightsCorona pic.twitter.com/0maqUE3PvG",en,en
1241255717165617153,1241255717165617153,1584773399000,2020-03-21,12:19:59,India Standard Time,18839785,narendramodi,Narendra Modi,,"Leveraging technology and the internet for a healthier planet. 

Google is doing its best to spread awareness on how to prevent the spread of COVID-19. 

Their efforts add great strength in this fight. https://twitter.com/Google/status/1238893403821113344 …",[],['https://twitter.com/Google/status/1238893403821113344'],[],416,3576,15557,[],[],https://twitter.com/narendramodi/status/1241255717165617153,False,https://twitter.com/Google/status/1238893403821113344,0,,,,,,,"[{'user_id': '18839785', 'username': 'narendramodi'}]",,"Leveraging technology and the internet for a healthier planet. 

Google is doing its best to spread awareness on how to prevent the spread of COVID-19. 

Their efforts add great strength in this fight. https://twitter.com/Google/status/1238893403821113344 …",en,en
1241056983651733504,1241056983651733504,1584726017000,2020-03-20,23:10:17,India Standard Time,18839785,narendramodi,Narendra Modi,,"Gratitude to @PMBhutan Dr. Lotay Tshering for his decision to contribute $100,000 to the COVID-19 Emergency Fund on behalf of the Bhutanese Government. It is wonderful to see SAARC leaders taking initiatives that are adding strength to the collective fight against Coronavirus.",['pmbhutan'],[],[],1189,6611,44647,[],[],https://twitter.com/narendramodi/status/1241056983651733504,False,,0,,,,,,,"[{'user_id': '18839785', 'username': 'narendramodi'}, {'user_id': '2902507831', 'username': 'PMBhutan'}]",,"Gratitude to @PMBhutan Dr. Lotay Tshering for his decision to contribute $100,000 to the COVID-19 Emergency Fund on behalf of the Bhutanese Government. It is wonderful to see SAARC leaders taking initiatives that are adding strength to the collective fight against Coronavirus.",en,en
1241056858825093120,1241056858825093120,1584725987000,2020-03-20,23:09:47,India Standard Time,18839785,narendramodi,Narendra Modi,,Deeply appreciate PM @kpsharmaoli’s announcement of contribution of NPR 10 crores to the COVID-19 Emergency Fund. It reflects Oli Ji’s commitment and support to the collective fight of SAARC countries against the pandemic.,['kpsharmaoli'],[],[],787,6151,44839,[],[],https://twitter.com/narendramodi/status/1241056858825093120,False,,0,,,,,,,"[{'user_id': '18839785', 'username': 'narendramodi'}, {'user_id': '2835736254', 'username': 'kpsharmaoli'}]",,Deeply appreciate PM @kpsharmaoli’s announcement of contribution of NPR 10 crores to the COVID-19 Emergency Fund. It reflects Oli Ji’s commitment and support to the collective fight of SAARC countries against the pandemic.,en,en
1241018587428487169,1241018585595523072,1584716862000,2020-03-20,20:37:42,India Standard Time,18839785,narendramodi,Narendra Modi,,Officials from the Centre briefed the Chief Ministers on the series of steps being taken to fight COVID-19. CMs shared aspects relating the preparedness of their respective states to combat Coronavirus. #IndiaFightsCorona,[],[],[],412,2359,12050,['#indiafightscorona'],[],https://twitter.com/narendramodi/status/1241018587428487169,False,,0,,,,,,,"[{'user_id': '18839785', 'username': 'narendramodi'}]",,Officials from the Centre briefed the Chief Ministers on the series of steps being taken to fight COVID-19. CMs shared aspects relating the preparedness of their respective states to combat Coronavirus. #IndiaFightsCorona,en,en
1241018585595523072,1241018585595523072,1584716862000,2020-03-20,20:37:42,India Standard Time,18839785,narendramodi,Narendra Modi,,"Today, via video conferencing, had an extensive interaction with Chief Ministers of various states to discuss ongoing efforts towards tackling COVID-19 menace. Discussed ways to curtail the spread and ensure our citizens are healthy. #IndiaFightsCorona http://nm-4.com/i4a9 ",[],['http://nm-4.com/i4a9'],[],1449,5344,29098,['#indiafightscorona'],[],https://twitter.com/narendramodi/status/1241018585595523072,False,,0,,,,,,,"[{'user_id': '18839785', 'username': 'narendramodi'}]",,"Today, via video conferencing, had an extensive interaction with Chief Ministers of various states to discuss ongoing efforts towards tackling COVID-19 menace. Discussed ways to curtail the spread and ensure our citizens are healthy. #IndiaFightsCorona http://nm-4.com/i4a9 ",en,en
1241006711793520641,1241006711793520641,1584714031000,2020-03-20,19:50:31,India Standard Time,18839785,narendramodi,Narendra Modi,,"बिहार की जनता को नमन, जिन्होंने अभी से 'जनता कर्फ्यू' की तैयारी कर ली है... https://youtu.be/ED5sW1fxt1E ",[],['https://youtu.be/ED5sW1fxt1E'],[],3720,11458,74378,[],[],https://twitter.com/narendramodi/status/1241006711793520641,False,,0,,,,,,,"[{'user_id': '18839785', 'username': 'narendramodi'}]",,"Salute to the people of Bihar, who have already prepared for the 'Janata Curfew' ... https://youtu.be/ED5sW1fxt1E",hi,en
1241006652196716545,1241006652196716545,1584714017000,2020-03-20,19:50:17,India Standard Time,18839785,narendramodi,Narendra Modi,,व्यापारियों का ये जज्बा देशवासियों को प्रेरित करने वाला है। कोरोना वायरस के खिलाफ देशव्यापी जंग में मददगार रहने वाला है। #IndiaFightsCorona https://khabar.ndtv.com/news/delhi-ncr/businessmen-support-pm-modis-call-for-janata-curfew-announces-delhi-trade-bandh-on-march-22-2197668 …,[],['https://khabar.ndtv.com/news/delhi-ncr/businessmen-support-pm-modis-call-for-janata-curfew-announces-delhi-trade-bandh-on-march-22-2197668'],[],733,5354,30745,['#indiafightscorona'],[],https://twitter.com/narendramodi/status/1241006652196716545,False,,0,,,,,,,"[{'user_id': '18839785', 'username': 'narendramodi'}]",,This spirit of businessmen is motivating to the countrymen. Corona is going to be helpful in the nationwide war against the virus. #IndiaFightsCorona https://khabar.ndtv.com/news/delhi-ncr/businessmen-support-pm-modis-call-for-janata-curfew-announces-delhi-trade-bandh-on-march-22-2197668…,hi,en
1241006309589147648,1241006309589147648,1584713935000,2020-03-20,19:48:55,India Standard Time,18839785,narendramodi,Narendra Modi,,"Some of the most phenomenal singers have something to say.

You have heard and loved their songs…do also hear them on this subject. #IndiaFightsCorona
 https://twitter.com/Kailashkher/status/1240688566545465344 …
 https://twitter.com/AdnanSamiLive/status/1240691882960678912 … https://twitter.com/Shankar_Live/status/1240888576704950272 …",[],"['https://twitter.com/Kailashkher/status/1240688566545465344', 'https://twitter.com/AdnanSamiLive/status/1240691882960678912', 'https://twitter.com/Shankar_Live/status/1240888576704950272']",[],299,2688,14352,['#indiafightscorona'],[],https://twitter.com/narendramodi/status/1241006309589147648,False,https://twitter.com/Shankar_Live/status/1240888576704950272,0,,,,,,,"[{'user_id': '18839785', 'username': 'narendramodi'}]",,"Some of the most phenomenal singers have something to say.

You have heard and loved their songs…do also hear them on this subject. #IndiaFightsCorona
 https://twitter.com/Kailashkher/status/1240688566545465344 …
 https://twitter.com/AdnanSamiLive/status/1240691882960678912 … https://twitter.com/Shankar_Live/status/1240888576704950272 …",en,en
1241005012551004160,1241005012551004160,1584713626000,2020-03-20,19:43:46,India Standard Time,18839785,narendramodi,Narendra Modi,,"Indian industry has a leading role to play in our progress. 

Heartening to see industry bodies at the forefront of fighting COVID-19. #IndiaFightsCorona
 https://twitter.com/ASSOCHAM4India/status/1240677272874414080 …
 https://twitter.com/ficci_india/status/1240899060443181056?s=20 … https://twitter.com/FollowCII/status/1240680311760904192 …",[],"['https://twitter.com/ASSOCHAM4India/status/1240677272874414080', 'https://twitter.com/ficci_india/status/1240899060443181056?s=20', 'https://twitter.com/FollowCII/status/1240680311760904192']",[],170,1675,7544,['#indiafightscorona'],[],https://twitter.com/narendramodi/status/1241005012551004160,False,https://twitter.com/FollowCII/status/1240680311760904192,0,,,,,,,"[{'user_id': '18839785', 'username': 'narendramodi'}]",,"Indian industry has a leading role to play in our progress. 

Heartening to see industry bodies at the forefront of fighting COVID-19. #IndiaFightsCorona
 https://twitter.com/ASSOCHAM4India/status/1240677272874414080 …
 https://twitter.com/ficci_india/status/1240899060443181056?s=20 … https://twitter.com/FollowCII/status/1240680311760904192 …",en,en
1241004802227572736,1241004802227572736,1584713576000,2020-03-20,19:42:56,India Standard Time,18839785,narendramodi,Narendra Modi,,"The young actors have something to say..

Its time to be 'Zyada Savdhan' and do 'Corona ka Punchnama'! #IndiaFightsCorona
 https://twitter.com/ayushmannk/status/1240701116943200257 …
 https://twitter.com/SidMalhotra/status/1240693103683465217 …
 https://twitter.com/varun_dvn/status/1240667520954060801 … https://twitter.com/TheAaryanKartik/status/1240672124978597889 …",[],"['https://twitter.com/ayushmannk/status/1240701116943200257', 'https://twitter.com/SidMalhotra/status/1240693103683465217', 'https://twitter.com/varun_dvn/status/1240667520954060801', 'https://twitter.com/TheAaryanKartik/status/1240672124978597889']",[],913,10492,54454,['#indiafightscorona'],[],https://twitter.com/narendramodi/status/1241004802227572736,False,https://twitter.com/TheAaryanKartik/status/1240672124978597889,0,,,,,,,"[{'user_id': '18839785', 'username': 'narendramodi'}]",,"The young actors have something to say..

Its time to be 'Zyada Savdhan' and do 'Corona ka Punchnama'! #IndiaFightsCorona
 https://twitter.com/ayushmannk/status/1240701116943200257 …
 https://twitter.com/SidMalhotra/status/1240693103683465217 …
 https://twitter.com/varun_dvn/status/1240667520954060801 … https://twitter.com/TheAaryanKartik/status/1240672124978597889 …",en,en
1241004256972255232,1241004256972255232,1584713446000,2020-03-20,19:40:46,India Standard Time,18839785,narendramodi,Narendra Modi,,"Its time we hear them again, for a very important cause to safeguard everyones health. #IndiaFightsCorona
 https://twitter.com/akshaykumar/status/1240660415601770497 …
 https://twitter.com/bhumipednekar/status/1240688030588874752 … https://twitter.com/AnupamPKher/status/1240660947062198272 …",[],"['https://twitter.com/akshaykumar/status/1240660415601770497', 'https://twitter.com/bhumipednekar/status/1240688030588874752', 'https://twitter.com/AnupamPKher/status/1240660947062198272']",[],279,2668,14646,['#indiafightscorona'],[],https://twitter.com/narendramodi/status/1241004256972255232,False,https://twitter.com/AnupamPKher/status/1240660947062198272,0,,,,,,,"[{'user_id': '18839785', 'username': 'narendramodi'}]",,"Its time we hear them again, for a very important cause to safeguard everyones health. #IndiaFightsCorona
 https://twitter.com/akshaykumar/status/1240660415601770497 …
 https://twitter.com/bhumipednekar/status/1240688030588874752 … https://twitter.com/AnupamPKher/status/1240660947062198272 …",en,en
1241002287486533633,1241002287486533633,1584712976000,2020-03-20,19:32:56,India Standard Time,18839785,narendramodi,Narendra Modi,,"Bipartisan support in such efforts are deeply appreciated. We have to fight this menace together. #IndiaFightsCorona
 https://twitter.com/supriya_sule/status/1240684622431817728 …
 https://twitter.com/PawanKalyan/status/1240987728289746950?s=20 … https://twitter.com/ncbn/status/1240696201395109889 …",[],"['https://twitter.com/supriya_sule/status/1240684622431817728', 'https://twitter.com/PawanKalyan/status/1240987728289746950?s=20', 'https://twitter.com/ncbn/status/1240696201395109889']",[],186,2058,10196,['#indiafightscorona'],[],https://twitter.com/narendramodi/status/1241002287486533633,False,https://twitter.com/ncbn/status/1240696201395109889,0,,,,,,,"[{'user_id': '18839785', 'username': 'narendramodi'}]",,"Bipartisan support in such efforts are deeply appreciated. We have to fight this menace together. #IndiaFightsCorona
 https://twitter.com/supriya_sule/status/1240684622431817728 …
 https://twitter.com/PawanKalyan/status/1240987728289746950?s=20 … https://twitter.com/ncbn/status/1240696201395109889 …",en,en
1241000263608971265,1241000263608971265,1584712494000,2020-03-20,19:24:54,India Standard Time,18839785,narendramodi,Narendra Modi,,"No, they are not telling you to attend a party. 

They have a different message... #IndiaFightsCorona
 https://twitter.com/GuruOfficial/status/1240933792950284288?s=20 … https://twitter.com/Its_Badshah/status/1240704061327831041?s=20 …",[],"['https://twitter.com/GuruOfficial/status/1240933792950284288?s=20', 'https://twitter.com/Its_Badshah/status/1240704061327831041?s=20']",[],342,2543,14700,['#indiafightscorona'],[],https://twitter.com/narendramodi/status/1241000263608971265,False,https://twitter.com/Its_Badshah/status/1240704061327831041,0,,,,,,,"[{'user_id': '18839785', 'username': 'narendramodi'}]",,"No, they are not telling you to attend a party. 

They have a different message... #IndiaFightsCorona
 https://twitter.com/GuruOfficial/status/1240933792950284288?s=20 … https://twitter.com/Its_Badshah/status/1240704061327831041?s=20 …",en,en
1240999199623114754,1240999199623114754,1584712240000,2020-03-20,19:20:40,India Standard Time,18839785,narendramodi,Narendra Modi,,"I would urge my fellow Indians to listen to what some of the most distinguished film personalities of the country have to say. #IndiaFightsCorona
 https://twitter.com/Mohanlal/status/1240675421005295616 …
 https://twitter.com/ajaydevgn/status/1240660077264044032 … https://twitter.com/ikamalhaasan/status/1240921388170350593 …",[],"['https://twitter.com/Mohanlal/status/1240675421005295616', 'https://twitter.com/ajaydevgn/status/1240660077264044032', 'https://twitter.com/ikamalhaasan/status/1240921388170350593']",[],642,3552,19429,['#indiafightscorona'],[],https://twitter.com/narendramodi/status/1240999199623114754,False,https://twitter.com/ikamalhaasan/status/1240921388170350593,0,,,,,,,"[{'user_id': '18839785', 'username': 'narendramodi'}]",,"I would urge my fellow Indians to listen to what some of the most distinguished film personalities of the country have to say. #IndiaFightsCorona
 https://twitter.com/Mohanlal/status/1240675421005295616 …
 https://twitter.com/ajaydevgn/status/1240660077264044032 … https://twitter.com/ikamalhaasan/status/1240921388170350593 …",en,en
1240998186665177090,1240998186665177090,1584711998000,2020-03-20,19:16:38,India Standard Time,18839785,narendramodi,Narendra Modi,,"The K3G family seeks your support for the Janata Curfew on 22nd. #IndiaFightsCorona
 https://twitter.com/karanjohar/status/1240683140873465859 …
 https://twitter.com/srbachchan/status/1240684935440023558 …
 https://twitter.com/iamsrk/status/1240907248521474048 … https://twitter.com/iHrithik/status/1240687688451100673 …",[],"['https://twitter.com/karanjohar/status/1240683140873465859', 'https://twitter.com/srbachchan/status/1240684935440023558', 'https://twitter.com/iamsrk/status/1240907248521474048', 'https://twitter.com/iHrithik/status/1240687688451100673']",[],323,3350,16433,['#indiafightscorona'],[],https://twitter.com/narendramodi/status/1240998186665177090,False,https://twitter.com/iHrithik/status/1240687688451100673,0,,,,,,,"[{'user_id': '18839785', 'username': 'narendramodi'}]",,"The K3G family seeks your support for the Janata Curfew on 22nd. #IndiaFightsCorona
 https://twitter.com/karanjohar/status/1240683140873465859 …
 https://twitter.com/srbachchan/status/1240684935440023558 …
 https://twitter.com/iamsrk/status/1240907248521474048 … https://twitter.com/iHrithik/status/1240687688451100673 …",en,en
1240997775803740161,1240997775803740161,1584711901000,2020-03-20,19:15:01,India Standard Time,18839785,narendramodi,Narendra Modi,,"Let us always remember, precautions, and not panic is the way ahead. Let us make the Janata Curfew effective. I thank people from different walks of life for supporting Janata Curfew.

 https://twitter.com/advani_kiara/status/1240697616867811328 …
 https://twitter.com/Rakulpreet/status/1240663232785731586 …
 https://twitter.com/manushichhillar/status/1240697191645073408 … https://twitter.com/itsBhushanKumar/status/1240671403499638785 …",[],"['https://twitter.com/advani_kiara/status/1240697616867811328', 'https://twitter.com/Rakulpreet/status/1240663232785731586', 'https://twitter.com/manushichhillar/status/1240697191645073408', 'https://twitter.com/itsBhushanKumar/status/1240671403499638785']",[],251,1802,9066,[],[],https://twitter.com/narendramodi/status/1240997775803740161,False,https://twitter.com/itsBhushanKumar/status/1240671403499638785,0,,,,,,,"[{'user_id': '18839785', 'username': 'narendramodi'}]",,"Let us always remember, precautions, and not panic is the way ahead. Let us make the Janata Curfew effective. I thank people from different walks of life for supporting Janata Curfew.

 https://twitter.com/advani_kiara/status/1240697616867811328 …
 https://twitter.com/Rakulpreet/status/1240663232785731586 …
 https://twitter.com/manushichhillar/status/1240697191645073408 … https://twitter.com/itsBhushanKumar/status/1240671403499638785 …",en,en
1240996849537835008,1240996849537835008,1584711680000,2020-03-20,19:11:20,India Standard Time,18839785,narendramodi,Narendra Modi,,"Here are 2 excellent cricketers whose partnership we will remember forever. Now, as they have said, it is time for another partnership. This time, all of India will be partners in the fight against Coronavirus. #IndiaFightsCorona
 https://twitter.com/YUVSTRONG12/status/1240678259777368070 … https://twitter.com/MohammadKaif/status/1240673202902196235 …",[],"['https://twitter.com/YUVSTRONG12/status/1240678259777368070', 'https://twitter.com/MohammadKaif/status/1240673202902196235']",[],217,2784,15744,['#indiafightscorona'],[],https://twitter.com/narendramodi/status/1240996849537835008,False,https://twitter.com/MohammadKaif/status/1240673202902196235,0,,,,,,,"[{'user_id': '18839785', 'username': 'narendramodi'}]",,"Here are 2 excellent cricketers whose partnership we will remember forever. Now, as they have said, it is time for another partnership. This time, all of India will be partners in the fight against Coronavirus. #IndiaFightsCorona
 https://twitter.com/YUVSTRONG12/status/1240678259777368070 … https://twitter.com/MohammadKaif/status/1240673202902196235 …",en,en
1240996707858436097,1240996707858436097,1584711646000,2020-03-20,19:10:46,India Standard Time,18839785,narendramodi,Narendra Modi,,"On the pitch, these people turned the ball and made India win. Now, they’re all appealing to us to turn the tide against Coronavirus.

Let’s all come together! #IndiaFightsCorona
 https://twitter.com/ashwinravi99/status/1240659129753952258 …
 https://twitter.com/harbhajan_singh/status/1240673703781756930 …
 https://twitter.com/imkuldeep18/status/1240668729811169280 … https://twitter.com/poonam_yadav24/status/1240670873905958912 …",[],"['https://twitter.com/ashwinravi99/status/1240659129753952258', 'https://twitter.com/harbhajan_singh/status/1240673703781756930', 'https://twitter.com/imkuldeep18/status/1240668729811169280', 'https://twitter.com/poonam_yadav24/status/1240670873905958912']",[],135,1719,8616,['#indiafightscorona'],[],https://twitter.com/narendramodi/status/1240996707858436097,False,https://twitter.com/poonam_yadav24/status/1240670873905958912,0,,,,,,,"[{'user_id': '18839785', 'username': 'narendramodi'}]",,"On the pitch, these people turned the ball and made India win. Now, they’re all appealing to us to turn the tide against Coronavirus.

Let’s all come together! #IndiaFightsCorona
 https://twitter.com/ashwinravi99/status/1240659129753952258 …
 https://twitter.com/harbhajan_singh/status/1240673703781756930 …
 https://twitter.com/imkuldeep18/status/1240668729811169280 … https://twitter.com/poonam_yadav24/status/1240670873905958912 …",en,en
1240995546547933184,1240995546547933184,1584711369000,2020-03-20,19:06:09,India Standard Time,18839785,narendramodi,Narendra Modi,,"Speed and precision have been the forte of these excellent players. Time for India to act speedily and methodically to combat COVID-19. #IndiaFightsCorona
 https://twitter.com/bhuviofficial/status/1240709152495697920 … https://twitter.com/JhulanG10/status/1240896731694260226 …",[],"['https://twitter.com/bhuviofficial/status/1240709152495697920', 'https://twitter.com/JhulanG10/status/1240896731694260226']",[],170,1739,9028,['#indiafightscorona'],[],https://twitter.com/narendramodi/status/1240995546547933184,False,https://twitter.com/JhulanG10/status/1240896731694260226,0,,,,,,,"[{'user_id': '18839785', 'username': 'narendramodi'}]",,"Speed and precision have been the forte of these excellent players. Time for India to act speedily and methodically to combat COVID-19. #IndiaFightsCorona
 https://twitter.com/bhuviofficial/status/1240709152495697920 … https://twitter.com/JhulanG10/status/1240896731694260226 …",en,en
